{
  "suite": "einstein_tiles_forms_0_15",
  "spec_version": "0.1.0",
  "rfc": "01",
  "status": "draft",
  "description": "Field extraction for the pinned draft fields (Form ID bits 36-39, South Halo bits 56-63); all remaining bits are reported as opaque payload.",
  "generator": "SHD-CCP/geometric-engine verification/export_golden_vectors.py",
  "binary": {
    "file": "einstein_tiles_forms_0_15.bin",
    "fields": [
      "tile",
      "form_id",
      "south_halo",
      "payload"
    ]
  },
  "cases": [
    {"tile": "0x0000000000000000", "form_id": 0, "south_halo": 0, "payload": "0x0000000000000000"},
    {"tile": "0xffffffffffffffff", "form_id": 15, "south_halo": 255, "payload": "0x00ffff0fffffffff"},
    {"tile": "0x0000000000000000", "form_id": 0, "south_halo": 0, "payload": "0x0000000000000000"},
    {"tile": "0xffffff0fffffffff", "form_id": 0, "south_halo": 255, "payload": "0x00ffff0fffffffff"},
    {"tile": "0x381fe007d1dc60cc", "form_id": 0, "south_halo": 56, "payload": "0x001fe007d1dc60cc"},
    {"tile": "0x7763f40cf0091f85", "form_id": 0, "south_halo": 119, "payload": "0x0063f40cf0091f85"},
    {"tile": "0x0000001000000000", "form_id": 1, "south_halo": 0, "payload": "0x0000000000000000"},
    {"tile": "0xffffff1fffffffff", "form_id": 1, "south_halo": 255, "payload": "0x00ffff0fffffffff"},
    {"tile": "0x79d4f21b7077de5a", "form_id": 1, "south_halo": 121, "payload": "0x00d4f20b7077de5a"},
    {"tile": "0x09e1141070b0fc45", "form_id": 1, "south_halo": 9, "payload": "0x00e1140070b0fc45"},
    {"tile": "0x0000002000000000", "form_id": 2, "south_halo": 0, "payload": "0x0000000000000000"},
    {"tile": "0xffffff2fffffffff", "form_id": 2, "south_halo": 255, "payload": "0x00ffff0fffffffff"},
    {"tile": "0xf6286f2d21acde01", "form_id": 2, "south_halo": 246, "payload": "0x00286f0d21acde01"},
    {"tile": "0x212dcc27bbc9a6f8", "form_id": 2, "south_halo": 33, "payload": "0x002dcc07bbc9a6f8"},
    {"tile": "0x0000003000000000", "form_id": 3, "south_halo": 0, "payload": "0x0000000000000000"},
    {"tile": "0xffffff3fffffffff", "form_id": 3, "south_halo": 255, "payload": "0x00ffff0fffffffff"},
    {"tile": "0xe974553f51faa454", "form_id": 3, "south_halo": 233, "payload": "0x0074550f51faa454"},
    {"tile": "0xa4f0bb30629f672c", "form_id": 3, "south_halo": 164, "payload": "0x00f0bb00629f672c"},
    {"tile": "0x0000004000000000", "form_id": 4, "south_halo": 0, "payload": "0x0000000000000000"},
    {"tile": "0xffffff4fffffffff", "form_id": 4, "south_halo": 255, "payload": "0x00ffff0fffffffff"},
    {"tile": "0xfd85ff44f3997283", "form_id": 4, "south_halo": 253, "payload": "0x0085ff04f3997283"},
    {"tile": "0x2bfae44ea0b36368", "form_id": 4, "south_halo": 43, "payload": "0x00fae40ea0b36368"},
    {"tile": "0x0000005000000000", "form_id": 5, "south_halo": 0, "payload": "0x0000000000000000"},
    {"tile": "0xffffff5fffffffff", "form_id": 5, "south_halo": 255, "payload": "0x00ffff0fffffffff"},
    {"tile": "0x59ac46504fd97f83", "form_id": 5, "south_halo": 89, "payload": "0x00ac46004fd97f83"},
    {"tile": "0x82857d51779ad33e", "form_id": 5, "south_halo": 130, "payload": "0x00857d01779ad33e"},
    {"tile": "0x0000006000000000", "form_id": 6, "south_halo": 0, "payload": "0x0000000000000000"},
    {"tile": "0xffffff6fffffffff", "form_id": 6, "south_halo": 255, "payload": "0x00ffff0fffffffff"},
    {"tile": "0x5fa23564db5184da", "form_id": 6, "south_halo": 95, "payload": "0x00a23504db5184da"},
    {"tile": "0x2b61b96f9663ef50", "form_id": 6, "south_halo": 43, "payload": "0x0061b90f9663ef50"},
    {"tile": "0x0000007000000000", "form_id": 7, "south_halo": 0, "payload": "0x0000000000000000"},
    {"tile": "0xffffff7fffffffff", "form_id": 7, "south_halo": 255, "payload": "0x00ffff0fffffffff"},
    {"tile": "0xe6f6907915d81fad", "form_id": 7, "south_halo": 230, "payload": "0x00f6900915d81fad"},
    {"tile": "0xff648772576f41d8", "form_id": 7, "south_halo": 255, "payload": "0x00648702576f41d8"},
    {"tile": "0x0000008000000000", "form_id": 8, "south_halo": 0, "payload": "0x0000000000000000"},
    {"tile": "0xffffff8fffffffff", "form_id": 8, "south_halo": 255, "payload": "0x00ffff0fffffffff"},
    {"tile": "0x5265bb819d97b8c9", "form_id": 8, "south_halo": 82, "payload": "0x0065bb019d97b8c9"},
    {"tile": "0xf7dbfe8484c604a5", "form_id": 8, "south_halo": 247, "payload": "0x00dbfe0484c604a5"},
    {"tile": "0x0000009000000000", "form_id": 9, "south_halo": 0, "payload": "0x0000000000000000"},
    {"tile": "0xffffff9fffffffff", "form_id": 9, "south_halo": 255, "payload": "0x00ffff0fffffffff"},
    {"tile": "0x923802997ecad7bf", "form_id": 9, "south_halo": 146, "payload": "0x003802097ecad7bf"},
    {"tile": "0x1c1bed95c6724b36", "form_id": 9, "south_halo": 28, "payload": "0x001bed05c6724b36"},
    {"tile": "0x000000a000000000", "form_id": 10, "south_halo": 0, "payload": "0x0000000000000000"},
    {"tile": "0xffffffafffffffff", "form_id": 10, "south_halo": 255, "payload": "0x00ffff0fffffffff"},
    {"tile": "0x2c101ca11c9cbb50", "form_id": 10, "south_halo": 44, "payload": "0x00101c011c9cbb50"},
    {"tile": "0xc94899a4e976ad7a", "form_id": 10, "south_halo": 201, "payload": "0x00489904e976ad7a"},
    {"tile": "0x000000b000000000", "form_id": 11, "south_halo": 0, "payload": "0x0000000000000000"},
    {"tile": "0xffffffbfffffffff", "form_id": 11, "south_halo": 255, "payload": "0x00ffff0fffffffff"},
    {"tile": "0x87f841bbce763e3d", "form_id": 11, "south_halo": 135, "payload": "0x00f8410bce763e3d"},
    {"tile": "0x65fa47b5d80ac41d", "form_id": 11, "south_halo": 101, "payload": "0x00fa4705d80ac41d"},
    {"tile": "0x000000c000000000", "form_id": 12, "south_halo": 0, "payload": "0x0000000000000000"},
    {"tile": "0xffffffcfffffffff", "form_id": 12, "south_halo": 255, "payload": "0x00ffff0fffffffff"},
    {"tile": "0x110839c6050f000c", "form_id": 12, "south_halo": 17, "payload": "0x00083906050f000c"},
    {"tile": "0x2c87e1c606f4a46e", "form_id": 12, "south_halo": 44, "payload": "0x0087e10606f4a46e"},
    {"tile": "0x000000d000000000", "form_id": 13, "south_halo": 0, "payload": "0x0000000000000000"},
    {"tile": "0xffffffdfffffffff", "form_id": 13, "south_halo": 255, "payload": "0x00ffff0fffffffff"},
    {"tile": "0xf8e3bdd87cd123d0", "form_id": 13, "south_halo": 248, "payload": "0x00e3bd087cd123d0"},
    {"tile": "0xeb71f8d2c3e34573", "form_id": 13, "south_halo": 235, "payload": "0x0071f802c3e34573"},
    {"tile": "0x000000e000000000", "form_id": 14, "south_halo": 0, "payload": "0x0000000000000000"},
    {"tile": "0xffffffefffffffff", "form_id": 14, "south_halo": 255, "payload": "0x00ffff0fffffffff"},
    {"tile": "0x42535dec50fa2768", "form_id": 14, "south_halo": 66, "payload": "0x00535d0c50fa2768"},
    {"tile": "0xed7270ed30918908", "form_id": 14, "south_halo": 237, "payload": "0x0072700d30918908"},
    {"tile": "0x000000f000000000", "form_id": 15, "south_halo": 0, "payload": "0x0000000000000000"},
    {"tile": "0xffffffffffffffff", "form_id": 15, "south_halo": 255, "payload": "0x00ffff0fffffffff"},
    {"tile": "0x458461f3857804b2", "form_id": 15, "south_halo": 69, "payload": "0x00846103857804b2"},
    {"tile": "0xc62b81f0857680a8", "form_id": 15, "south_halo": 198, "payload": "0x002b8100857680a8"}
  ]
}
